{
  "$schema": "http://json-schema.org/draft-07/schema#",
  "type": "object",
  "required": ["name", "displayName", "type"],
  "title": "Source definition schema",
  "description": "The schema for a source definition. This is used to validate the source definition configuration files (db-config.json).",
  "properties": {
    "name": {
      "type": "string",
      "title": "Name",
      "description": "A unique name for a source without any whitespace or special characters.",
      "$comment": "Typically, all the characters are in lowercase with words separated by underscores.",
      "pattern": "^[a-zA-Z0-9_-]+$",
      "examples": ["bigquery", "active_campaign"]
    },
    "displayName": {
      "type": "string",
      "title": "Display Name",
      "description": "A human-readable name for a source, typically, derived from the branding of the source.",
      "$comment": "This will be used in the front-end (web app), docs, etc. to identify a source.",
      "pattern": "^[a-zA-Z0-9_ .\\-\\(\\)/]+$",
      "examples": ["Active campaign", "Zendesk Chat"]
    },
    "category": {
      "type": "string",
      "title": "Category",
      "description": "The category of the source.",
      "enum": ["webhook", "cloud", "warehouse", "singer-protocol"]
    },
    "type": {
      "type": "string",
      "title": "Type",
      "description": "The type of the source.",
      "enum": [
        "cloud",
        "cloudSource",
        "amp",
        "android",
        "androidKotlin",
        "ocaml",
        "warehouse",
        "cordova",
        "flutter",
        "ios",
        "iosSwift",
        "web",
        "reactnative",
        "shopify",
        "unity"
      ]
    },
    "options": {
      "type": "object",
      "title": "Options",
      "description": "The options for the source.",
      "$comment": "This hosts miscellaneous information about the source.",
      "properties": {
        "hydration": {
          "type": "object",
          "description": "Processor hydration stage configuration options.",
          "properties": {
            "enabled": {
              "type": "boolean",
              "description": "Enable/disable processor's hydration stage."
            }
          }
        },
        "isBeta": {
          "type": "boolean",
          "title": "Is Beta",
          "description": "Whether the source is in beta.",
          "$comment": "This is used to display a 'beta' badge in the UI.",
          "default": false
        },
        "deprecated": {
          "type": "boolean",
          "title": "Deprecated",
          "description": "Whether the source is deprecated.",
          "$comment": "This is used to display a 'deprecated' badge in the UI.",
          "default": false
        },
        "deprecationLabel": {
          "type": "string",
          "title": "Deprecation Label",
          "description": "The deprecation label for the source.",
          "$comment": "This is used to display a deprecation label in the UI when options.deprecated is 'true'.",
          "default": "Deprecated"
        },
        "icon": {
          "type": "string",
          "title": "Icon",
          "description": "Name of the icon in @rudderlabs/icons (the RudderStack Integration Icons Figma library) that represents this source.",
          "$comment": "Kebab-case icon name, e.g. 'braze'. Several definitions may share one icon. Renaming or removing an icon is a breaking change in @rudderlabs/icons.",
          "pattern": "^[a-z0-9]+(-[a-z0-9]+)*$"
        },
        "isNew": {
          "type": "boolean",
          "title": "Is New",
          "description": "Whether the source is newly added.",
          "$comment": "This is used to display a 'New' badge in the UI.",
          "default": false
        },
        "legacy": {
          "type": "object",
          "title": "Legacy",
          "description": "Presence of this field indicates that the source is legacy.",
          "properties": {
            "notice": {
              "type": "string",
              "title": "Notice",
              "description": "The notice for the source. This is typically used to inform the user about the existing source instances.",
              "$comment": "This is used to display a notice in the UI when the source is legacy."
            },
            "selectionNotice": {
              "type": "string",
              "title": "Selection Notice",
              "description": "The selection notice for the source. This is typically used to inform the user while creating a new source instance.",
              "$comment": "This is used to display a selection notice in the UI while creating a new source instance."
            },
            "migrationGuide": {
              "type": "string",
              "title": "Migration Guide",
              "description": "The migration guide URL for the source.",
              "$comment": "This is used to display a migration guide URL in the UI when the source is legacy."
            }
          },
          "additionalProperties": false,
          "minProperties": 1
        },
        "hidden": {
          "anyOf": [
            {
              "type": "boolean",
              "title": "Hidden",
              "description": "Whether the source is hidden.",
              "$comment": "This is used to hide the source from the UI.",
              "default": false
            },
            {
              "type": "object",
              "title": "Hidden Gate",
              "description": "Feature flags or billing features that hide the source when they match their expected values.",
              "$comment": "This is used to hide the source from the UI based on one or more gates.",
              "additionalProperties": false,
              "required": ["gate"],
              "properties": {
                "gate": {
                  "type": "object",
                  "title": "Hidden Gate",
                  "description": "Feature flags or billing features that hide the source when their reduction matches.",
                  "additionalProperties": false,
                  "required": ["flags"],
                  "properties": {
                    "flags": {
                      "type": "array",
                      "title": "Hidden Gate Flags",
                      "description": "Feature flags or billing features that must match their expected values for the source to be hidden.",
                      "minItems": 1,
                      "items": {
                        "type": "object",
                        "additionalProperties": false,
                        "required": ["name", "value"],
                        "properties": {
                          "name": {
                            "type": "string",
                            "title": "Name",
                            "description": "The exact feature name resolved by the webapp."
                          },
                          "value": {
                            "type": "boolean",
                            "title": "Value",
                            "description": "The boolean value that hides the source."
                          }
                        }
                      }
                    },
                    "condition": {
                      "type": "string",
                      "title": "Condition",
                      "description": "How multiple hidden gate flags should be combined.",
                      "enum": ["and", "or"]
                    }
                  },
                  "allOf": [
                    {
                      "if": {
                        "properties": {
                          "flags": {
                            "type": "array",
                            "minItems": 2
                          }
                        },
                        "required": ["flags"]
                      },
                      "then": {
                        "properties": {
                          "condition": {
                            "enum": ["and", "or"]
                          }
                        },
                        "required": ["condition"]
                      }
                    }
                  ]
                }
              }
            }
          ]
        },
        "syncBehaviours": {
          "type": "array",
          "title": "Sync Behaviours",
          "description": "TBD",
          "items": {
            "type": "string",
            "enum": ["mirror", "upsert", "full"]
          },
          "uniqueItems": true
        },
        "isSqlModelSupported": {
          "type": "boolean",
          "title": "Is SQL Model Supported",
          "description": "TBD"
        },
        "isAudienceSupported": {
          "type": "boolean",
          "title": "Is Audience Supported",
          "description": "TBD"
        },
        "isDataGraphSupported": {
          "type": "boolean",
          "title": "Is Data Graph Supported",
          "description": "To identify warehouses that are supported by Data Graph"
        },
        "isCredentialsValidationSupported": {
          "type": "boolean",
          "title": "Is Credentials Validation Supported",
          "description": "TBD"
        },
        "skipWarehouseSchemaConfig": {
          "type": "boolean",
          "title": "Skip Warehouse Schema Config",
          "description": "TBD"
        },
        "image": {
          "type": "string",
          "title": "Image",
          "description": "TBD"
        },
        "digest": {
          "type": "string",
          "title": "Digest",
          "description": "TBD"
        },
        "auth": {
          "type": "object",
          "title": "Auth",
          "description": "TBD",
          "properties": {
            "provider": {
              "type": "string",
              "title": "Provider",
              "description": "TBD",
              "enum": ["Google", "Xero"]
            },
            "oauthRole": {
              "type": "string",
              "title": "OAuth Role",
              "description": "TBD"
            }
          }
        },
        "gaMetricIds": {
          "type": "array",
          "title": "GA Metric IDs",
          "description": "TBD",
          "items": {
            "type": "string"
          },
          "uniqueItems": true
        },
        "gaDimensionIds": {
          "type": "array",
          "title": "GA Dimension IDs",
          "description": "TBD",
          "items": {
            "type": "string"
          },
          "uniqueItems": true
        },
        "supportsDestinationSyncMode": {
          "type": "boolean",
          "title": "Supports Destination Sync Mode",
          "description": "TBD"
        },
        "sdkExecutionEnvironment": {
          "type": "string",
          "title": "SDK Execution Environment",
          "description": "It denotes the environment in which the SDK is executed. The presence of this field also indicates that the source is an SDK source.",
          "enum": ["server", "client"]
        },
        "internalSecretKeys": {
          "type": "array",
          "title": "Internal Secret Keys",
          "description": "List of field names that contain secret values that should be stored securely.",
          "items": {
            "type": "string"
          },
          "uniqueItems": true
        },
        "cacheEnabled": {
          "type": "boolean",
          "title": "Cache Enabled",
          "description": "Indicates that we need to cache the source data for integrations-webhook-router.",
          "default": false
        }
      }
    },
    "config": {
      "type": "object",
      "title": "Configuration",
      "description": "This hosts all the source parameters.",
      "properties": {
        "supportedAccountDefinitions": {
          "type": "object",
          "title": "Supported Account Definitions",
          "description": "Account definitionIds for the source.",
          "$comment": "Account definitionIds (each the `name` of an account definition under this source's accounts/ directory) that this source supports. The account's secret and option fields are declared on the referenced account definition itself (its config.secretFields / config.optionFields, validated by the account's secretSchema / optionsSchema).",
          "minProperties": 1,
          "properties": {
            "rudderAccountId": {
              "type": "array",
              "title": "Rudder Account Id",
              "description": "The account definitionId for the source.",
              "items": {
                "type": "string"
              },
              "minItems": 1,
              "uniqueItems": true
            }
          }
        }
      }
    }
  }
}
