{
  "name": "singer-klaviyo-v2",
  "category": "singer-protocol",
  "displayName": "Klaviyo v2",
  "options": {
    "image": "422074288268.dkr.ecr.us-east-1.amazonaws.com/rudderstack/source-klaviyo:v8.4.1",
    "isBeta": true,
    "hidden": false,
    "icon": "klaviyo"
  },
  "type": "cloudSource"
}
